{
  "agent_stack": "browser-mock",
  "backend_kind": "mock",
  "backend_model": "mock-model",
  "benchmark_id": "bench.examples.campaign.neutral.v1",
  "created_at": "1970-01-01T00:00:00Z",
  "duration_ms": 0,
  "execution_mode": "browser_mock",
  "id": "resp-v-browser-q02",
  "prompt_id": "q02",
  "prompt_text": "List three trade-offs between dense retrieval and lexical search for agent tool-calling documentation, in under 120 words.",
  "response_text": "[browser_mock][mock:mock-model] a8eb387ee95e6fd1",
  "schema_version": 1,
  "variant_id": "v-browser"
}
