{
  "agent_stack": "repo-governed",
  "backend_kind": "mock",
  "backend_model": "mock-model",
  "benchmark_id": "bench.examples.campaign.neutral.v1",
  "created_at": "1970-01-01T00:00:00Z",
  "duration_ms": 0,
  "execution_mode": "repo_governed",
  "id": "resp-v-repo-q05",
  "prompt_id": "q05",
  "prompt_text": "Draft a short checklist for reviewing an agent-generated pull request that adds a new JSON artifact schema.",
  "response_text": "[repo_governed][mock:mock-model] a2e13f85a273accf",
  "schema_version": 1,
  "variant_id": "v-repo"
}
