{
  "agent_stack": "alwm-cli",
  "backend_kind": "mock",
  "backend_model": "mock-model",
  "benchmark_id": "bench.examples.campaign.neutral.v1",
  "created_at": "1970-01-01T00:00:00Z",
  "duration_ms": 0,
  "execution_mode": "cli",
  "id": "resp-v-cli-q01",
  "prompt_id": "q01",
  "prompt_text": "Summarize how you would structure a small RAG pipeline for Markdown notes in a git repo, including where JSON Schema validation fits.",
  "response_text": "[mock:mock-model] 693cfa837400371e",
  "schema_version": 1,
  "variant_id": "v-cli"
}
