{
  "agent_stack": "alwm-cli",
  "backend_kind": "mock",
  "backend_model": "mock-model",
  "benchmark_id": "bench.examples.campaign.neutral.v1",
  "created_at": "1970-01-01T00:00:00Z",
  "duration_ms": 0,
  "execution_mode": "cli",
  "id": "resp-v-cli-q02",
  "prompt_id": "q02",
  "prompt_text": "List three trade-offs between dense retrieval and lexical search for agent tool-calling documentation, in under 120 words.",
  "response_text": "[mock:mock-model] a8eb387ee95e6fd1",
  "schema_version": 1,
  "variant_id": "v-cli"
}
