{
  "agent_stack": "alwm-cli",
  "backend_kind": "mock",
  "backend_model": "mock-model",
  "benchmark_id": "bench.examples.campaign.success_heavy.v1",
  "created_at": "1970-01-01T00:00:00Z",
  "duration_ms": 0,
  "execution_mode": "cli",
  "id": "resp-v-cli-q13",
  "prompt_id": "q13",
  "prompt_text": "Write a short success checklist for onboarding a new contributor who will run just ci and a local offline benchmark suite.",
  "response_text": "[mock:mock-model] 014af7f491724aeb",
  "schema_version": 1,
  "variant_id": "v-cli"
}
