{
  "agent_stack": "alwm-cli",
  "backend_kind": "mock",
  "backend_model": "mock-model",
  "benchmark_id": "bench.examples.campaign.success_heavy.v1",
  "created_at": "1970-01-01T00:00:00Z",
  "duration_ms": 0,
  "execution_mode": "cli",
  "id": "resp-v-cli-q11",
  "prompt_id": "q11",
  "prompt_text": "Celebrate a green CI run: list what artifacts you would attach to the weekly report when lint, typecheck, and offline benchmarks all pass.",
  "response_text": "[mock:mock-model] daaeb01f73687b5f",
  "schema_version": 1,
  "variant_id": "v-cli"
}
