{
  "schema_version": 1,
  "id": "fixture-benchmark-response-001",
  "benchmark_id": "bench.fixture",
  "variant_id": "v1",
  "prompt_id": "p1",
  "agent_stack": "alwm-cli",
  "execution_mode": "cli",
  "backend_kind": "mock",
  "backend_model": "mock-model",
  "prompt_text": "ping",
  "response_text": "pong",
  "duration_ms": 1,
  "created_at": "1970-01-01T00:00:00Z"
}
