{
  "agent_stack": "alwm-cli",
  "backend_kind": "mock",
  "backend_model": "mock-model",
  "benchmark_id": "bench.examples.campaign.success_heavy.v1",
  "created_at": "1970-01-01T00:00:00Z",
  "duration_ms": 0,
  "execution_mode": "cli",
  "id": "resp-v-cli-q12",
  "prompt_id": "q12",
  "prompt_text": "Describe a crisp \u201cdefinition of done\u201d for closing a benchmark ticket when matrices and Markdown reports are already in examples/.",
  "response_text": "[mock:mock-model] 4a46d4bd7397a9fb",
  "schema_version": 1,
  "variant_id": "v-cli"
}
