{
  "agent_stack": "alwm-cli",
  "backend_kind": "mock",
  "backend_model": "mock-model",
  "benchmark_id": "bench.examples.campaign.neutral.v1",
  "created_at": "1970-01-01T00:00:00Z",
  "duration_ms": 0,
  "execution_mode": "cli",
  "id": "resp-v-cli-q03",
  "prompt_id": "q03",
  "prompt_text": "Propose a minimal experiment protocol to compare two local LLM backends on the same prompt set, including what you would log per run.",
  "response_text": "[mock:mock-model] 3212e90eedfafb62",
  "schema_version": 1,
  "variant_id": "v-cli"
}
